{
  "schema": "https://deepworkplan.com/schema/benchmark-record/v1.json",
  "plan": "PLAN_102_fixture_unmetered",
  "title": "unmetered record - nulls stay null",
  "generation": "v6",
  "contract_id": "bbbbbbbbbbbbbbbbbbbbbbbbbbbbbbbbbbbbbbbbbbbbbbbbbbbbbbbbbbbbbbbb",
  "status": "in_progress",
  "versions": {
    "dwp_skill": "6.0.2",
    "spec": "6.0.0",
    "agent_tool": "unknown"
  },
  "timing": {
    "first_event_ts": "2026-02-02T08:00:00Z",
    "last_event_ts": "2026-02-02T08:45:00Z",
    "span_seconds": 2700,
    "task_count_spanned": 2
  },
  "shape": {
    "tasks": 3,
    "criteria": 3,
    "invariants": 1,
    "gate_intents": 3,
    "events": 14
  },
  "friction": {
    "adaptations": 0,
    "amendments": 0,
    "interventions": 0,
    "refusals": 1,
    "retries": 0
  },
  "gates": {
    "runs": 2,
    "exit_0": 2,
    "exit_nonzero": 0,
    "evidence_histogram": {
      "observed": 2,
      "imported": 0,
      "asserted": 0
    }
  },
  "metered": {
    "flag": false,
    "tokens": null,
    "spend_usd": null
  },
  "environment": {
    "repo": "fixture-repo",
    "branch": "unknown"
  },
  "diff_stats": {
    "available": false,
    "files": null,
    "insertions": null,
    "deletions": null
  }
}
